{
  "schemaVersion": "1.0",
  "bankType": "music-concept-questions",
  "level": "National 3",
  "source": {
    "knowledgeBankFile": "Music_Concept_Knowledge_Bank_Ultimate_Codex_Edition.json",
    "knowledgeBankSchemaVersion": "5.0",
    "knowledgeBankSha256": "1b8ae6e92b1889f3aceba17da7acbe721874ebed637866e55030a54e7860053e"
  },
  "questions": [
    {
      "id": "MCQ-N3-MC0001-F01-E-001",
      "level": "National 3",
      "category": "Styles",
      "categories": [
        "Styles"
      ],
      "conceptId": "MC-0001",
      "concept": "Blues",
      "factId": "MC-0001-F01",
      "supportingFactIds": [],
      "senseId": null,
      "senseContext": null,
      "comparisonGroupId": null,
      "difficulty": "Easy",
      "questionType": "feature_identification",
      "answerMode": "concept",
      "question": "It is usually in 4/4 and often uses a 12-bar chord pattern. 8-bar and 16-bar forms are also used. What is this?",
      "answers": [
        {
          "text": "Blues",
          "correct": true
        },
        {
          "text": "Latin American",
          "correct": false
        },
        {
          "text": "Musical",
          "correct": false
        },
        {
          "text": "Pop",
          "correct": false
        }
      ],
      "hint": "Twelve bars, bent notes and call and response.",
      "hintFactId": null,
      "explanation": "It is usually in 4/4 and often uses a 12-bar chord pattern. 8-bar and 16-bar forms are also used.",
      "literacyLink": null
    },
    {
      "id": "MCQ-N3-MC0001-F01-M-001",
      "level": "National 3",
      "category": "Styles",
      "categories": [
        "Styles"
      ],
      "conceptId": "MC-0001",
      "concept": "Blues",
      "factId": "MC-0001-F01",
      "supportingFactIds": [],
      "senseId": null,
      "senseContext": null,
      "comparisonGroupId": null,
      "difficulty": "Medium",
      "questionType": "feature_exclusion",
      "answerMode": "not_feature",
      "question": "Which is NOT a feature of Blues?",
      "answers": [
        {
          "text": "It is a staged work combining songs, spoken dialogue, acting and dance.",
          "correct": true,
          "featureOfConceptId": "MC-0004"
        },
        {
          "text": "It is often in 4/4 and often follows a 12-bar chord pattern.",
          "correct": false,
          "featureOfConceptId": "MC-0001"
        },
        {
          "text": "Blue notes, call and response and repeated riffs are common.",
          "correct": false,
          "featureOfConceptId": "MC-0001"
        },
        {
          "text": "Improvisation is an important part of the style.",
          "correct": false,
          "featureOfConceptId": "MC-0001"
        }
      ],
      "hint": "Spoken dialogue, songs, acting and dancing on stage.",
      "hintFactId": null,
      "explanation": "The statement “It is a staged work combining songs, spoken dialogue, acting and dance” describes Musical, not Blues. It is usually in 4/4 and often uses a 12-bar chord pattern. 8-bar and 16-bar forms are also used.",
      "literacyLink": null,
      "featureSourceConceptId": "MC-0004"
    },
    {
      "id": "MCQ-N3-MC0002-F01-E-001",
      "level": "National 3",
      "category": "Styles",
      "categories": [
        "Styles"
      ],
      "conceptId": "MC-0002",
      "concept": "Jazz",
      "factId": "MC-0002-F01",
      "supportingFactIds": [],
      "senseId": null,
      "senseContext": null,
      "comparisonGroupId": null,
      "difficulty": "Easy",
      "questionType": "feature_identification",
      "answerMode": "concept",
      "question": "Common features are syncopation, improvisation, distinctive harmony and instrumental solos, played by small groups or big bands. What is this?",
      "answers": [
        {
          "text": "Musical",
          "correct": false
        },
        {
          "text": "Jazz",
          "correct": true
        },
        {
          "text": "Pop",
          "correct": false
        },
        {
          "text": "Rock",
          "correct": false
        }
      ],
      "hint": "Syncopation, improvisation and instrumental solos.",
      "hintFactId": null,
      "explanation": "Common features are syncopation, improvisation, distinctive harmony and instrumental solos, played by small groups or big bands.",
      "literacyLink": null
    },
    {
      "id": "MCQ-N3-MC0002-F01-M-001",
      "level": "National 3",
      "category": "Styles",
      "categories": [
        "Styles"
      ],
      "conceptId": "MC-0002",
      "concept": "Jazz",
      "factId": "MC-0002-F01",
      "supportingFactIds": [],
      "senseId": null,
      "senseContext": null,
      "comparisonGroupId": null,
      "difficulty": "Medium",
      "questionType": "feature_exclusion",
      "answerMode": "not_feature",
      "question": "Which is NOT a feature of Jazz?",
      "answers": [
        {
          "text": "Syncopation and improvisation are common features.",
          "correct": false,
          "featureOfConceptId": "MC-0002"
        },
        {
          "text": "It is a staged work combining songs, spoken dialogue, acting and dance.",
          "correct": true,
          "featureOfConceptId": "MC-0004"
        },
        {
          "text": "Instrumental solos and distinctive harmony are often heard.",
          "correct": false,
          "featureOfConceptId": "MC-0002"
        },
        {
          "text": "Saxophone, trumpet, piano, bass and drum kit are common instruments.",
          "correct": false,
          "featureOfConceptId": "MC-0002"
        }
      ],
      "hint": "Spoken dialogue, songs, acting and dancing on stage.",
      "hintFactId": null,
      "explanation": "The statement “It is a staged work combining songs, spoken dialogue, acting and dance” describes Musical, not Jazz. Common features are syncopation, improvisation, distinctive harmony and instrumental solos, played by small groups or big bands.",
      "literacyLink": null,
      "featureSourceConceptId": "MC-0004"
    },
    {
      "id": "MCQ-N3-MC0003-F01-E-001",
      "level": "National 3",
      "category": "Styles",
      "categories": [
        "Styles"
      ],
      "conceptId": "MC-0003",
      "concept": "Latin American",
      "factId": "MC-0003-F01",
      "supportingFactIds": [],
      "senseId": null,
      "senseContext": null,
      "comparisonGroupId": null,
      "difficulty": "Easy",
      "questionType": "feature_identification",
      "answerMode": "concept",
      "question": "Dance music from Latin America, often with lively syncopated or off-beat rhythms, a strong pulse and clear percussion. What is this?",
      "answers": [
        {
          "text": "Pop",
          "correct": false
        },
        {
          "text": "Rock",
          "correct": false
        },
        {
          "text": "Latin American",
          "correct": true
        },
        {
          "text": "Rock 'n' roll",
          "correct": false
        }
      ],
      "hint": "Think salsa rhythms, bongos and claves.",
      "hintFactId": null,
      "explanation": "Dance music from Latin America, often with lively syncopated or off-beat rhythms, a strong pulse and clear percussion.",
      "literacyLink": null
    },
    {
      "id": "MCQ-N3-MC0003-F01-M-001",
      "level": "National 3",
      "category": "Styles",
      "categories": [
        "Styles"
      ],
      "conceptId": "MC-0003",
      "concept": "Latin American",
      "factId": "MC-0003-F01",
      "supportingFactIds": [],
      "senseId": null,
      "senseContext": null,
      "comparisonGroupId": null,
      "difficulty": "Medium",
      "questionType": "feature_exclusion",
      "answerMode": "not_feature",
      "question": "Which is NOT a feature of Latin American?",
      "answers": [
        {
          "text": "It often has lively syncopated or off-beat rhythms.",
          "correct": false,
          "featureOfConceptId": "MC-0003"
        },
        {
          "text": "A strong dance pulse and prominent percussion are common.",
          "correct": false,
          "featureOfConceptId": "MC-0003"
        },
        {
          "text": "Distorted electric-guitar riffs and a heavy amplified sound are central.",
          "correct": true,
          "featureOfConceptId": "MC-0006"
        },
        {
          "text": "Bongos, guiro, castanets or claves may be used.",
          "correct": false,
          "featureOfConceptId": "MC-0003"
        }
      ],
      "hint": "Amplified guitars, a driving beat and distortion.",
      "hintFactId": null,
      "explanation": "The statement “Distorted electric-guitar riffs and a heavy amplified sound are central” describes Rock, not Latin American. Dance music from Latin America, often with lively syncopated or off-beat rhythms, a strong pulse and clear percussion.",
      "literacyLink": null,
      "featureSourceConceptId": "MC-0006"
    },
    {
      "id": "MCQ-N3-MC0004-F01-E-001",
      "level": "National 3",
      "category": "Styles",
      "categories": [
        "Styles"
      ],
      "conceptId": "MC-0004",
      "concept": "Musical",
      "factId": "MC-0004-F01",
      "supportingFactIds": [],
      "senseId": null,
      "senseContext": null,
      "comparisonGroupId": null,
      "difficulty": "Easy",
      "questionType": "definition",
      "answerMode": "concept",
      "question": "A stage show with speaking, songs, acting and usually dancing. What is this?",
      "answers": [
        {
          "text": "Rock",
          "correct": false
        },
        {
          "text": "Rock 'n' roll",
          "correct": false
        },
        {
          "text": "Scottish",
          "correct": false
        },
        {
          "text": "Musical",
          "correct": true
        }
      ],
      "hint": "Spoken dialogue, songs, acting and dancing on stage.",
      "hintFactId": null,